[
  {
    "id": 1,
    "module": "bootstrap",
    "title": "Project scaffolding",
    "regime": "build",
    "dependencies": [],
    "status": "complete"
  },
  {
    "id": 2,
    "module": "event_store",
    "title": "Core storage",
    "regime": "build",
    "dependencies": [],
    "status": "in_progress"
  },
  {
    "id": 3,
    "module": "event_store",
    "title": "Query interface",
    "regime": "build",
    "dependencies": [],
    "status": "pending"
  },
  {
    "id": 4,
    "module": "orchestrator",
    "title": "Pipeline + event loop",
    "regime": "build",
    "dependencies": ["event_store"],
    "status": "pending"
  }
]
